itemName,itemDescription,pictureUrl,itemPrice,restaurantId
Past marriage finish.,Director lose turn real step without talk discuss month method morning could.,https://placekitten.com/37/974,77,7.868
Future staff start.,Near center year else once community thus article form bit.,https://dummyimage.com/417x146,13,6.1
Fight.,Station win surface sea sister much sell.,https://dummyimage.com/585x708,47,9.801
Number technology.,Chair behind pass cold plant pick month discuss Congress in deep major.,https://dummyimage.com/220x887,56,26.298
Book position consumer.,Back walk dinner available morning seem build far technology sound budget weight political enjoy such politics.,https://placekitten.com/430/982,21,43.909
Modern article indicate.,Item blood lay ground dinner tend hit guess what then after environmental.,https://dummyimage.com/271x540,88,16.459
Environment factor fight.,Total collection a task town responsibility her hard laugh positive personal agree even.,https://dummyimage.com/730x315,9,41.952
Reality will development daughter.,Whose show audience cover player rich front get first provide source do.,https://dummyimage.com/146x221,38,21.642
National him itself thing.,Arm present cost natural positive least economic season would east similar common similar.,https://picsum.photos/254/576,53,19.456
Require may.,Other year dog physical fine bring later base.,https://dummyimage.com/132x481,8,20.857
Anyone themselves eight.,Hear seek set old stand example choose bar.,https://dummyimage.com/878x158,81,5.622
Fear move.,Tax section somebody low agree personal morning including heavy throw.,https://placekitten.com/162/148,68,17.513
Tell program.,Explain interest admit level development coach include baby alone phone decide put third individual notice discuss.,https://placekitten.com/941/566,82,7.581
Deal structure.,Or order leg too commercial billion drop suggest appear another these station less subject grow.,https://picsum.photos/948/555,25,40.652
Something degree spring.,Keep who should sort friend rise interview onto their challenge once five his very.,https://dummyimage.com/981x241,44,43.802
Report girl hand act.,Southern face foreign occur five who wait less finish watch myself start middle force article.,https://placekitten.com/185/830,14,11.124
Party author guess.,Four yard stuff daughter interest scientist peace present card.,https://dummyimage.com/117x799,78,49.742
Against boy.,Will spend teach support often design organization first.,https://dummyimage.com/200x123,33,19.065
Believe life nothing.,Better actually focus defense whose police stay.,https://picsum.photos/938/37,4,26.401
Plant at us.,Exist professor until talk five range card such social shake resource cup foot.,https://dummyimage.com/692x768,48,35.964
Discussion though.,Prove find plant someone much few nothing nearly.,https://placekitten.com/462/98,93,5.219
Pay strong maybe.,Cover believe social record second court stage first read glass them itself themselves indicate image.,https://picsum.photos/863/671,57,6.271
Everybody evidence picture.,Federal list beautiful finish music clear concern management image wide director.,https://picsum.photos/167/587,23,17.265
Let energy.,Gun health thank fear computer thus conference claim husband peace natural.,https://dummyimage.com/821x877,3,44.346
Recognize put nation fire.,Onto sign next including data cup guess tend why.,https://placekitten.com/376/714,67,46.932
Reason onto west.,Man mission throw couple national popular western call professional fast population perhaps participant mouth quality.,https://picsum.photos/833/399,22,39.674
Can authority kind.,Respond apply attack reveal reduce collection arrive next carry win old.,https://picsum.photos/544/761,38,29.315
Education management bag.,Impact institution over brother choice rule Mr these budget.,https://placekitten.com/207/894,89,7.007
Director force.,Build six something institution high hot some you federal should news month able project.,https://dummyimage.com/623x403,0,47.316
Safe walk.,We garden place other move scene central before.,https://dummyimage.com/684x748,85,21.829
Interest trade once treatment.,Accept require series purpose tonight piece value many.,https://placekitten.com/883/778,30,28.426
Smile once citizen.,Spend senior tend include practice industry perhaps hard push finally often least question.,https://placekitten.com/222/138,78,34.071
Protect none.,Western as road up spend seem force accept minute really position operation book animal if.,https://placekitten.com/216/959,39,5.217
Him everybody.,Skill write certain quickly air effect early range.,https://picsum.photos/603/362,76,10.851
Rise down learn.,With else arrive ask catch number check activity never and look eat city catch likely.,https://placekitten.com/480/991,63,36.648
Success push tree.,Bill current everything whose consider impact them answer research high two easy economy clearly business.,https://dummyimage.com/997x364,30,20.385
Outside behind pull today.,Serve final condition never floor ten around table during those attention bring watch low.,https://dummyimage.com/460x459,28,32.536
Analysis question.,Hot marriage field subject student face act early identify left law east budget.,https://dummyimage.com/659x49,57,40.824
May money agency.,Radio throughout last player that per article.,https://dummyimage.com/756x817,4,7.348
Speech item him.,Leg a side window Republican player drive evidence price myself source color begin.,https://dummyimage.com/417x727,41,29.911
Specific need.,Prevent board issue eat institution traditional teacher throughout agent sometimes sing when teach get fall.,https://placekitten.com/689/481,21,31.326
Well high east.,Cut population foot sense they more force suffer.,https://picsum.photos/6/1023,17,49.122
Major.,Card dark artist decision bar drop song course social different interesting able trouble still base.,https://placekitten.com/481/834,87,45.308
Nation discussion rich police.,Could coach response politics offer road wish.,https://placekitten.com/329/615,25,36.42
About charge.,Receive lose explain adult sea reach box media every.,https://picsum.photos/783/387,49,27.601
Light enter.,Room eight law sister expect break picture.,https://placekitten.com/154/974,81,29.144
Institution soldier method.,Stay society letter early authority someone sound across Democrat feel catch though purpose evening attack.,https://placekitten.com/64/334,97,26.719
Often involve pattern.,Individual road yes receive degree single know artist thousand appear put perform send campaign because.,https://placekitten.com/766/618,76,20.985
Lead suddenly necessary about.,Culture service boy thought behavior theory need by fine dream wide.,https://picsum.photos/62/56,96,13.252
Arrive election.,Voice window happy month two travel at evidence.,https://placekitten.com/437/845,32,33.647
Become floor.,Special to she concern western first tonight final wonder right while.,https://dummyimage.com/697x44,22,25.023
Prove much for.,Already yes type film house police trouble author agreement power similar area deep economy establish.,https://placekitten.com/892/846,96,26.465
When adult.,Figure kind arm organization listen different space education take spend thought.,https://picsum.photos/679/230,74,40.423
Read collection fight.,Loss price federal happy decade challenge event guy actually a film room.,https://placekitten.com/290/547,85,42.151
Action.,Born city Mrs tough to smile show former strong detail throw specific think.,https://dummyimage.com/278x95,41,7.967
Social think.,Run collection strategy determine add process majority public say explain itself cost particular.,https://dummyimage.com/694x339,63,15.511
Whom note imagine.,Manage analysis whom between several call land feel expect movie minute help account.,https://picsum.photos/282/860,62,27.127
Why.,Model not civil production build range miss few form amount add cup sister by south present.,https://placekitten.com/448/133,77,12.839
Check no husband.,Parent real different word newspaper authority PM tree apply training get according among general.,https://placekitten.com/699/498,74,48.86
Increase under.,Decision wind include response general forward recently trip.,https://placekitten.com/404/66,20,21.475
Speech newspaper my.,Feel sound rise offer involve Democrat hotel my month including news.,https://picsum.photos/68/664,19,14.984
Whom cost store receive.,Perhaps at after dinner include who summer society minute.,https://placekitten.com/431/670,44,38.326
Real gas.,Whether us try feel mention firm leg customer unit you Mrs in range stuff research.,https://picsum.photos/43/87,55,18.478
We prove.,Teacher Congress although during simple present American away value only finish.,https://dummyimage.com/616x33,7,8.871
Series professor late.,Successful pull produce stand participant really book down.,https://placekitten.com/332/1015,70,20.632
Series grow.,Majority my individual oil enter with who window toward really dog summer.,https://dummyimage.com/225x704,93,21.795
Operation owner.,Although seem town animal likely reduce although loss entire onto president.,https://placekitten.com/938/22,94,40.032
Record three player.,Fast firm financial Congress summer live ground get thought because challenge item consumer control.,https://picsum.photos/191/897,36,37.285
Certain interest culture.,General camera size recent spring partner kitchen among.,https://placekitten.com/572/654,26,18.297
Tell energy whom congress.,Change most really Mrs prepare treatment practice must nation defense suffer rich improve.,https://dummyimage.com/278x764,68,24.085
Story night wait store.,Program him bank dog but story writer position shake radio experience.,https://dummyimage.com/193x504,53,23.159
Final reduce.,Serious newspaper describe in reach PM paper task force their strong pull smile front record majority.,https://dummyimage.com/458x496,78,33.56
Cause.,Newspaper central decade ago his war behavior maybe road represent about report traditional ability two base.,https://dummyimage.com/922x873,26,23.452
Themselves poor.,Program attention site point good institution identify price method question.,https://placekitten.com/574/76,79,26.706
Too.,Past up however general nothing perhaps career black focus must read race.,https://picsum.photos/499/88,93,35.832
Better important.,Several feeling choose short teach size law use minute onto southern nation strategy machine raise job.,https://picsum.photos/63/213,3,27.477
Decide rate safe.,Pm sense state effect value we fill yes responsibility.,https://placekitten.com/144/611,70,31.905
Operation own.,Public together report employee successful his education.,https://picsum.photos/42/578,7,40.094
Bed million goal.,Successful hair describe alone daughter image boy manager full in fast across.,https://dummyimage.com/139x825,61,7.029
Wide clear without.,Clearly if next behind truth town difficult else value teach our again either behavior surface.,https://dummyimage.com/219x34,80,28.535
Film knowledge tree.,Indicate culture party fill include sing he candidate.,https://placekitten.com/906/937,42,42.193
Rise effect.,Discuss material situation economy suddenly eat road sort happy.,https://dummyimage.com/912x991,89,21.323
Choose look point real.,Performance recent on event opportunity end good seat beautiful north nation consider question order consider.,https://picsum.photos/273/700,82,48.593
Society term.,Tonight society fight since everybody star front claim cost recent.,https://dummyimage.com/287x42,23,9.306
Resource particular.,Teacher reason house his second not along follow road himself arrive girl.,https://picsum.photos/139/888,48,30.291
Knowledge test all.,Mind though prepare strong thing indicate speech.,https://dummyimage.com/749x698,15,38.657
Reality early.,Base card case medical help owner Republican sea paper pressure note important.,https://picsum.photos/629/606,17,20.565
Most determine process.,Eight follow energy price piece interest where war rule more.,https://placekitten.com/93/747,81,30.743
Tree phone.,Home area recently history open consumer add.,https://placekitten.com/208/351,66,28.136
Usually song.,Effort even fact all trouble upon lose year purpose alone form available our give cost.,https://picsum.photos/347/688,1,39.576
Interest us ready.,Role choice low especially much until kid law write they several result skin.,https://dummyimage.com/490x559,83,14.799
Business full hold.,Deep easy high though he claim teacher choice hear scene data among direction lot positive.,https://placekitten.com/148/21,29,33.27
Wife approach agent.,College himself former we quickly they by maintain apply long.,https://picsum.photos/199/921,52,5.797
Option line.,Season inside popular role should possible owner.,https://dummyimage.com/875x241,80,29.285
The think.,Before always this let know course see mother one make common example face give line.,https://placekitten.com/553/638,27,43.592
Plant research.,Pretty however style himself feeling husband attorney sense letter we perhaps.,https://dummyimage.com/467x757,48,45.972
Discuss since give experience.,Admit project well religious dark me event company raise player speech.,https://picsum.photos/951/49,14,5.086
Eat side city.,Represent start call since show moment pass.,https://placekitten.com/959/255,93,44.629
Wish choose.,Consumer month matter green could question store growth group million base whatever.,https://placekitten.com/71/153,1,46.585
Four say.,Color with want card sister organization car any environmental wrong professor industry memory across.,https://picsum.photos/488/678,65,14.056
I difference.,Yard hand economy benefit serve color claim allow.,https://dummyimage.com/1x597,83,44.786
Social threat.,Position sound woman woman create eight front large.,https://placekitten.com/651/643,81,10.702
Story idea.,Why discover along dog education style fish usually miss its as rate physical safe.,https://placekitten.com/453/905,16,48.819
Force mr movement.,Member you speak local ground understand bill thousand start.,https://placekitten.com/290/215,56,49.944
Follow little.,Partner chair question appear land rise management power fact enter several mother statement.,https://picsum.photos/245/137,15,34.402
Step door.,Positive cost herself keep cause seven have cover fall fight special unit factor race be.,https://picsum.photos/308/808,21,32.928
That old.,Edge onto those this follow professor enough story meet appear half item if side rate.,https://dummyimage.com/457x1004,15,33.749
Media response relationship.,Surface break front entire hear attorney away other between above rule leader work laugh similar.,https://picsum.photos/556/689,69,49.551
Eat college.,Side she prepare use low type check out east tend science collection.,https://picsum.photos/62/605,31,17.708
Contain myself cut.,Pass news successful action mission state later.,https://placekitten.com/345/225,41,42.044
Trip college.,Green high positive learn about bar among tell remain stay series how necessary decide room.,https://placekitten.com/386/948,86,14.333
Condition central.,Maybe would management left top ground power deal somebody show Republican help theory choice end.,https://placekitten.com/313/362,54,16.819
Hit price air.,Security check human raise month enough structure charge most design quite let.,https://placekitten.com/135/635,49,40.064
Somebody help statement.,Away image president wall book peace prevent.,https://dummyimage.com/10x631,9,49.142
Direction day.,Soon before politics great before his arm field eye over smile prevent send.,https://picsum.photos/693/240,8,33.184
What magazine describe they.,Society expert building space free daughter where.,https://picsum.photos/53/372,57,26.725
Note.,Brother rule this science fish garden rest alone determine resource ball or.,https://placekitten.com/571/310,45,14.434
History majority.,Watch look natural plant employee learn remember check they.,https://picsum.photos/731/245,32,37.862
Key no i.,Set central generation own different begin worry effort despite key whose oil send expert above.,https://dummyimage.com/35x831,93,22.291
She stock.,Will task tree nothing somebody owner figure loss brother know gun list true day possible.,https://dummyimage.com/835x131,57,46.671
Pattern number tax.,Name rock black push line onto military Mrs simply light quickly bring service body.,https://picsum.photos/745/349,19,15.022
War international herself.,Maintain final onto early win day lead relate trade central race it example computer.,https://placekitten.com/566/378,44,48.033
International color exist.,Many rate economic second way list director picture concern exactly only group environment with there.,https://dummyimage.com/154x108,28,10.189
Stand save.,Second Congress international paper year yeah close oil happy model benefit follow.,https://dummyimage.com/395x805,1,36.788
Low never life.,During plan mean water spend bad remain article draw to culture class.,https://dummyimage.com/771x344,47,14.193
Door direction.,Current scientist technology with team follow about evidence western stop college morning society system build represent.,https://picsum.photos/371/279,90,15.021
Do professional finally edge.,Brother consumer others society fire sense coach city ever party think outside center.,https://picsum.photos/622/193,91,46.844
Local set.,Whether investment air rule issue others new tough.,https://dummyimage.com/539x317,9,11.17
Identify.,Bad control today employee child yet forward half.,https://picsum.photos/193/481,36,41.913
Later election.,Point kitchen management end think war defense range.,https://placekitten.com/915/700,57,24.22
Evening.,Bad partner drug bit mouth election security positive receive near control trade success.,https://placekitten.com/442/723,38,5.103
Long.,Such professor race role letter bank upon deal ground pressure understand table offer.,https://dummyimage.com/563x352,81,46.198
Appear as participant.,Worker understand mission deep least turn difficult along throw almost certainly by control.,https://placekitten.com/594/842,14,15.857
Contain more.,Recognize beautiful remember tough character throw develop hold teach pretty medical make about tend.,https://picsum.photos/355/96,75,13.617
War assume race.,Clear government look just card region economy mother final.,https://placekitten.com/767/562,27,35.901
Major response thousand.,Red section realize research beyond six because someone forward reflect four citizen industry yard.,https://picsum.photos/316/914,14,45.72
Art rather purpose.,By let tell arrive group impact city many no risk Mrs.,https://dummyimage.com/883x256,33,10.895
I throughout.,He success happy lot exist step ago.,https://placekitten.com/878/407,80,34.59
Answer beautiful significant.,Amount yes base far now office white threat eye computer candidate main table president central.,https://placekitten.com/572/550,32,40.832
Cultural ahead difficult.,Oil front unit industry Mrs no religious expert.,https://picsum.photos/290/986,3,13.392
Movie do economy.,Environment second or result air free indeed tonight.,https://placekitten.com/237/125,79,25.235
From business design thank.,Dinner instead anyone least southern wait chair actually turn represent writer increase.,https://dummyimage.com/724x878,22,35.207
Improve religious spring region.,Red southern however interesting language sort free partner ability then establish interest nice have.,https://placekitten.com/427/385,92,21.694
Media.,Call piece write off among camera system.,https://picsum.photos/642/862,80,47.199
Beautiful opportunity.,Democrat win want his base reduce catch resource own forget deal suggest close than well.,https://picsum.photos/564/711,76,18.694
Woman guess worker.,Agent officer form partner upon rich recognize give while.,https://placekitten.com/271/489,35,46.541
Door response.,Professional left somebody yourself find put answer western buy.,https://placekitten.com/689/585,55,27.524
Might forward rate mission.,Any goal walk wind other around fund when prevent customer military campaign early benefit these stand.,https://dummyimage.com/504x257,87,33.958
Owner idea away.,Second item central government something successful ten.,https://placekitten.com/137/116,90,34.786
Anything speech.,Expect dream sea leader pick protect capital weight these crime special would tree Congress.,https://dummyimage.com/904x561,16,49.496
National green.,Event easy live attention pretty professional beautiful very possible usually country note interesting anything question design.,https://dummyimage.com/529x999,46,13.27
Prevent information price.,Care their kind now environment allow full.,https://picsum.photos/738/937,38,42.559
Fact money.,Sell other exactly personal course environment money near institution air economy.,https://picsum.photos/656/539,2,27.541
Require fact fine.,Race into no military physical improve decide drop.,https://dummyimage.com/248x871,62,35.162
Mission eight.,Sit degree case miss paper fill candidate.,https://dummyimage.com/583x526,96,43.238
Adult blue.,Ahead suffer theory second they probably director theory present dark operation.,https://dummyimage.com/341x642,56,21.529
Eat worker morning.,Learn color training week stop marriage light.,https://picsum.photos/109/835,91,19.799
Here.,He home like force couple attack myself understand region argue store want traditional.,https://picsum.photos/502/124,9,42.228
Art deep act.,Include a whose by sound single race author must meet camera.,https://placekitten.com/619/403,64,43.68
Peace yeah.,Information wind alone movement size find particularly why.,https://dummyimage.com/747x97,87,31.071
Interest area beat.,From tonight whether enjoy garden red security why six.,https://picsum.photos/418/445,59,49.552
Present listen room.,Surface whole line him tax way character sea interview reflect ready stock necessary staff soon career.,https://dummyimage.com/189x724,41,48.517
Challenge beyond.,Still company nothing we whose close score research training add ball.,https://placekitten.com/853/42,79,42.733
Service purpose.,Could remember mean huge chair summer look per nearly measure prevent.,https://placekitten.com/675/564,23,34.376
I maintain.,Grow fear activity process environment trial marriage crime go lead stay hold thought similar.,https://placekitten.com/705/158,99,24.755
Even fly church.,Better enter toward ready seven within artist force vote produce buy institution.,https://placekitten.com/721/758,11,40.745
Concern new.,Game account suddenly nature under official day class share.,https://placekitten.com/712/352,1,47.638
Lawyer power.,Loss oil yourself agree nature behind growth have always dinner member cut science get room.,https://placekitten.com/236/945,34,10.722
Lay quite.,Sound medical well me result tough we relate able finally current.,https://picsum.photos/393/155,83,27.235
Stand.,Study back response other type consumer popular wind government argue year reason.,https://dummyimage.com/369x817,7,6.623
Yard almost school effort.,Data tree husband pressure official during agent.,https://picsum.photos/332/415,11,17.545
Idea everybody goal.,Suddenly by drive do us six we west school treatment police.,https://dummyimage.com/897x922,81,45.343
Need.,Offer remember skin better official determine tough security human old simple economy suggest more.,https://dummyimage.com/953x88,39,18.674
Plant full tree.,Girl teach owner fast notice rather statement.,https://dummyimage.com/263x905,79,40.123
Race a top.,Thus economic land article senior student writer.,https://placekitten.com/602/86,2,35.435
History.,Art day hope else without serious upon room hot health article become person anything art.,https://dummyimage.com/596x415,84,30.903
Possible party whose.,Side finally their music administration house our available far effort kind treatment.,https://dummyimage.com/27x737,5,7.224
Thing job agency.,Police what rich save hospital memory provide citizen suddenly everything education positive.,https://dummyimage.com/464x890,82,24.25
Current page wish.,Name husband agree cover boy outside stop design lawyer sense Congress.,https://picsum.photos/373/245,59,7.897
North save want.,Sell worry heavy force investment country want contain report standard military oil reveal of safe.,https://picsum.photos/207/742,78,43.446
Could federal mr.,Game store other day bank two evidence man garden paper former seat young.,https://placekitten.com/731/639,76,27.958
Ask different.,Story loss others big up most fill reveal bring.,https://picsum.photos/528/82,6,30.548
Leader weight.,Mean win financial particularly these carry plant can true so.,https://picsum.photos/6/102,31,12.096
During before recognize.,View itself rich bring through among apply her individual bill small everyone others.,https://picsum.photos/765/157,58,44.142
Increase last once public.,Small leader letter practice dinner establish audience charge treat.,https://placekitten.com/975/44,37,14.953
Notice.,Near develop cup do property set plan federal nothing focus deal at.,https://picsum.photos/438/54,5,13.797
West thousand road.,The poor high rule drive dark discover main medical evening majority south.,https://dummyimage.com/110x360,39,24.867
Capital bring.,Usually place fall their project important cause watch parent site son keep.,https://picsum.photos/485/612,25,24.643
Kid.,Lead low despite computer add various small commercial kind pattern you song rich.,https://placekitten.com/352/530,65,7.181
Run do.,Fear rule style everyone best perform after green me nice last sense writer himself continue.,https://placekitten.com/767/363,58,31.488
Could summer himself.,Easy increase form because pick several there seven where.,https://picsum.photos/40/789,24,48.796
Enough culture yourself.,Respond trial sort free list beautiful away give list door indeed hold debate.,https://dummyimage.com/980x469,48,28.485
Threat.,Religious budget network community address wide account staff wife know media human base dog doctor.,https://picsum.photos/844/363,22,25.322
