itemName,itemDescription,pictureUrl,itemPrice,restaurantId
Term.,Goal require compare car late somebody much budget detail recent.,https://placekitten.com/236/200,0,28.587
Up with.,Candidate design discuss politics really daughter notice continue country.,https://dummyimage.com/211x474,95,19.932
Table where enter.,Hope safe particular action inside drop financial world none property store girl high.,https://picsum.photos/528/78,45,42.431
Discussion full.,Third option eight kid democratic according financial else attorney soldier week mind international professional.,https://placekitten.com/639/686,44,37.733
Kind do.,Bed sort they walk cell finally miss type human medical.,https://picsum.photos/968/321,99,28.0
Office under sense.,Ever international first local bring could determine TV rule perform other hour watch rule east.,https://picsum.photos/315/421,64,21.925
Writer blue them military.,Watch board art help surface story concern early ability become set effect fund candidate.,https://dummyimage.com/500x755,25,24.756
American court cut.,Threat under stand art than remember you marriage purpose evening manager identify officer practice already.,https://dummyimage.com/797x86,29,24.928
Term color.,Suffer example listen oil daughter environmental seat probably opportunity expect.,https://dummyimage.com/835x218,35,39.385
Beat.,Treat charge reflect story lot spring news leg me see.,https://placekitten.com/979/415,63,32.611
Discover strong any senior.,Blood could long court south follow baby rich land us west figure.,https://placekitten.com/701/957,38,28.787
Again deep be.,Each report least network guy scientist general want test.,https://dummyimage.com/1000x846,38,24.034
Personal war people.,Face environmental cup cell once reveal focus threat.,https://dummyimage.com/976x883,21,11.333
During range team.,Strong approach need college name matter public fish fine necessary case radio consider wait generation.,https://dummyimage.com/1011x239,71,6.62
Sign five lawyer tell.,Think truth garden we religious plan once.,https://placekitten.com/150/493,95,8.244
Size rich if.,South popular end rather land run include race blood.,https://picsum.photos/557/311,99,12.925
Explain international series painting.,Less hour audience land piece young discover sometimes phone claim article news wait buy but relate.,https://dummyimage.com/199x354,34,11.564
Radio least.,Matter parent medical resource indeed fall town kitchen worker forward poor example still form later.,https://placekitten.com/991/752,21,34.282
Detail check beat.,News though cup president front kid own poor something power current arm race last decision.,https://placekitten.com/482/823,75,42.918
General pull single.,Available continue kind describe girl discover describe indicate moment month in issue.,https://dummyimage.com/879x959,18,8.666
Ever program economic.,Reveal represent realize reflect sort herself rest street fish artist break wind interesting analysis.,https://picsum.photos/115/798,14,19.84
Face process student.,Sport friend land north strategy difficult represent economic.,https://placekitten.com/839/582,7,26.547
Culture national road.,Call this that blood others know call partner goal likely decade stop strategy.,https://dummyimage.com/868x564,62,32.392
About.,Such remember discussion care such must great medical.,https://placekitten.com/593/931,52,37.048
Alone discover.,Administration try maintain detail leave impact trouble evidence foreign.,https://placekitten.com/719/351,44,11.688
Than recent.,Peace travel coach rule political impact responsibility ahead five various store store trade.,https://picsum.photos/760/672,49,10.783
Situation college new door.,Else world general sell feeling be increase one century cold Mrs who suffer suggest second site.,https://dummyimage.com/883x228,49,12.863
Man fire.,Exist represent site face describe consider star memory though who decide very.,https://dummyimage.com/948x413,99,42.84
Data teach.,Which edge tree realize simple today language clearly than capital score daughter as it any must.,https://placekitten.com/698/463,31,32.942
These plan.,Including sea account receive prove day few either eat price huge.,https://placekitten.com/878/267,99,37.869
Sense stay.,Above I energy conference month material hospital national reality set.,https://dummyimage.com/717x141,65,13.679
Cup.,Thing shake best clear reason physical clearly fish surface actually expert down this.,https://placekitten.com/933/125,0,29.951
Drug become.,Stop strategy stage think radio act senior.,https://picsum.photos/12/723,77,42.255
Property yourself he.,Democratic significant perhaps work like few front staff reality nothing chance task.,https://placekitten.com/58/424,7,47.808
Music field response.,Heart respond would seem make however police government.,https://placekitten.com/896/583,98,48.839
Billion none everything lose.,Simply can fund tough talk who just attorney body or report million company because time.,https://dummyimage.com/336x801,55,14.631
Certain finish.,Decision tell account magazine song decide although.,https://picsum.photos/787/256,95,16.856
Sit best.,Court tend test mind our manager have.,https://picsum.photos/671/877,52,11.158
Foot describe.,Particularly miss successful relationship which traditional near them.,https://placekitten.com/844/267,78,25.365
Policy win forward.,Admit case reduce only fund medical general community paper ball cost career leave player.,https://picsum.photos/314/217,39,19.11
Buy skin.,Society hit explain knowledge commercial old check piece.,https://placekitten.com/175/733,91,42.084
Most scene.,Wish visit effect most everybody tend culture gas condition against where blood produce day outside political.,https://placekitten.com/577/799,0,49.699
Start word which.,Short occur agent her station president brother role mean stage.,https://dummyimage.com/952x952,14,25.228
Career south.,Fund involve show both stage challenge raise wonder fly which really kind.,https://placekitten.com/391/725,16,7.03
Everyone traditional.,Occur check green and camera such court plant house police center why provide.,https://picsum.photos/0/52,66,23.56
Plan material such.,Consumer leader travel power raise six song budget time no treat writer perform especially return.,https://placekitten.com/425/8,44,19.341
Discover seat dinner.,Human key interest rather determine benefit management white artist.,https://picsum.photos/793/542,29,32.002
Single others.,Everything financial real matter pull worker attack he or democratic player door decade officer at give.,https://dummyimage.com/849x149,40,27.559
Write rule.,Health experience bag something morning management instead some.,https://picsum.photos/106/727,98,39.239
Clearly own.,Recent public nothing sound arm talk policy these behavior case ever describe wide degree perhaps.,https://placekitten.com/5/501,18,35.083
Even conference.,Lawyer plant test whose summer each treatment story it easy idea difficult support open law.,https://placekitten.com/769/926,41,13.035
Class character its.,Save professor heart positive admit center sound dog day station left.,https://dummyimage.com/536x59,66,49.515
Long people.,Quality prove take in network stock people bar what image police.,https://dummyimage.com/819x724,87,18.253
Put range.,Throw fear key investment large chair perform style along.,https://dummyimage.com/706x361,41,29.494
Its thought walk.,Maybe painting the return analysis media attention foreign including heavy science at develop campaign father.,https://dummyimage.com/796x869,16,36.804
Rich it.,Now large treat head red so physical reality all wonder often.,https://placekitten.com/1002/338,82,21.195
That drop place.,Century suffer society ready interest series any vote bill though surface particularly result.,https://picsum.photos/758/762,3,9.071
Whom table up.,Project sign board happy practice pass detail air.,https://picsum.photos/634/598,87,19.137
Brother newspaper wonder.,Rest same available environmental listen hard phone letter.,https://picsum.photos/185/238,78,33.609
Day walk.,Save nearly page child pattern bill industry article action everybody avoid policy trouble discussion.,https://picsum.photos/80/618,17,21.568
Than scientist.,Democrat air marriage entire world account window company say shake.,https://dummyimage.com/662x758,59,46.279
End federal fly.,Explain tough stuff decision value bad sea identify.,https://picsum.photos/213/54,19,26.819
Line drug nice.,Laugh site great town past offer size green pay.,https://picsum.photos/671/511,2,20.742
Space customer parent.,Them process around pass time not common.,https://placekitten.com/618/742,99,24.455
Study rich husband.,Window nothing mind reveal wish choice meet report clearly contain.,https://placekitten.com/634/22,44,5.465
Section city.,Interview dog last kind now social officer painting scene leader before dark whose.,https://picsum.photos/768/370,69,39.495
Debate new.,Speak society theory ability herself artist have ago risk.,https://picsum.photos/784/602,19,40.043
His receive sound.,Federal language whose another so sure event trade hour.,https://dummyimage.com/797x516,5,47.044
Role ok tend.,Base available necessary card admit buy property sense top either money cold center always.,https://placekitten.com/487/374,21,40.359
Step live top tree.,Brother play give wrong pull travel president.,https://picsum.photos/495/828,63,7.063
Impact improve for.,Seek why lead edge value both fish draw anyone purpose growth establish others would decide.,https://picsum.photos/193/838,4,18.486
Simply action yet.,Give follow culture in owner some fear see stock policy pull value evening character peace plant.,https://placekitten.com/934/780,93,13.821
Develop respond once rich.,Establish another black cell think professional condition against computer place.,https://placekitten.com/523/369,53,6.826
Forget major treatment.,Prove white likely list room message without piece husband itself community among.,https://placekitten.com/9/456,24,10.204
Door reason.,Weight can big measure in carry when.,https://placekitten.com/477/605,74,39.102
Miss computer half.,Executive American message Republican decide firm sound maintain born stage full share PM woman task.,https://dummyimage.com/117x971,85,41.594
Will first work.,Production mention able serve relationship line water theory lead figure democratic.,https://picsum.photos/54/23,76,20.112
History former nice.,Dream Congress four choice add you PM help maintain.,https://picsum.photos/957/9,11,32.351
Old when.,Young assume church moment focus once always treatment product might president.,https://picsum.photos/23/909,86,16.864
All bank.,Court deal light where with those responsibility.,https://placekitten.com/836/342,51,20.651
Against threat.,Matter effort effect again media bed onto idea site sell yourself believe project.,https://placekitten.com/342/968,72,12.875
Four scientist.,Exist plan entire least inside on others exactly red suddenly around from.,https://dummyimage.com/107x989,2,12.96
Money statement.,Practice energy president less financial thought you space history north hour inside population car.,https://placekitten.com/765/465,91,33.475
Term.,There point factor reduce crime life head million seat model father would cold.,https://dummyimage.com/868x312,8,21.755
By news raise.,Throughout effect kitchen former close education then experience data attention improve us.,https://picsum.photos/662/782,59,14.012
Enjoy concern call.,Campaign court up central artist compare senior discover rest father mean science pull institution various.,https://dummyimage.com/963x424,27,33.533
Free quite support.,Media develop past position catch real hot.,https://picsum.photos/467/913,47,18.662
Course result pull.,Hot significant through model really member radio.,https://picsum.photos/24/497,37,45.528
Once politics former.,Player thank expert maybe school remember ask pressure avoid voice agent say improve.,https://picsum.photos/187/264,28,10.386
Prepare.,Risk dream garden get turn model really rest standard particularly wait tonight also clearly.,https://placekitten.com/831/889,51,20.966
Night despite.,Manager increase will value against all onto live together game site enjoy shake.,https://placekitten.com/969/305,76,44.149
Law author.,Democratic professional customer sound talk check mention hope close now especially.,https://placekitten.com/677/134,13,14.633
Total security.,From whole effect cost office smile continue effect take plan entire issue.,https://placekitten.com/745/938,0,45.457
Occur message.,Simple professor view particular mean responsibility behind against result actually able minute middle.,https://picsum.photos/18/938,12,34.101
Drop compare.,Data class order prevent deal according claim process ever scene never mean official cut determine different.,https://dummyimage.com/902x720,99,21.944
Never standard charge.,Quality sell throw question economic cell loss turn perhaps get question team mother real available then.,https://dummyimage.com/179x221,65,20.056
Establish law.,Heart old choose approach similar race sort more miss including smile black.,https://placekitten.com/639/80,28,13.228
Anything speech politics.,Make blood lot approach even offer particular budget suddenly future although book country politics tough stock.,https://placekitten.com/104/307,27,8.257
Radio commercial bar.,Large whose energy bar bar loss poor many PM.,https://picsum.photos/719/744,72,37.823
Job spend girl.,Contain us social line east early two among full let local.,https://dummyimage.com/457x644,96,11.462
Consumer life.,Expect car ahead draw president crime oil.,https://dummyimage.com/1022x763,0,30.292
Laugh say experience.,And least back little future apply produce focus degree.,https://dummyimage.com/254x205,59,25.292
Finish challenge.,Consumer official lawyer him yet continue stand four job response.,https://placekitten.com/167/790,0,19.388
Yeah threat.,Carry action peace science reflect option the nothing pass pick blood phone life prove.,https://placekitten.com/139/117,44,23.105
Report forward as.,Offer sell author old treatment forget just also make.,https://placekitten.com/28/641,13,6.768
Medical suggest.,Behind image stage yourself despite market group decide everybody.,https://dummyimage.com/576x919,25,34.306
Blood pretty.,Three tough before management set blue author approach shoulder just.,https://picsum.photos/667/965,22,8.811
Trade example late.,Offer political sit behavior sit protect enter try explain current draw open economy source total.,https://placekitten.com/1017/309,13,5.777
Consumer house.,Hand by probably family operation plan soon tree arrive race second.,https://picsum.photos/884/174,35,19.815
Think report at.,From government raise for American voice whole within relationship president address consider individual.,https://picsum.photos/77/291,66,15.138
Audience me probably.,Gas long improve describe method officer nation expert lose event art reveal light model claim.,https://dummyimage.com/964x563,63,41.961
Language i.,Specific study everyone realize only you own sit century ask all health enjoy war place.,https://picsum.photos/760/192,27,12.739
Stock stuff.,East close too believe teach nearly who other.,https://dummyimage.com/553x900,56,47.128
Build can.,Check small leader his you ask coach year send finally example reveal phone budget.,https://placekitten.com/391/645,45,21.776
Me kind pay.,Road set lawyer feel throw teacher hair building moment level.,https://picsum.photos/531/526,82,8.35
Language source place.,Result must glass attention treatment billion report page shoulder I stand picture agree as sign.,https://picsum.photos/62/31,79,43.738
Room take.,Me figure reason total plant pick region stage protect treatment team.,https://dummyimage.com/835x146,42,39.192
Skin main.,Fact sing world attorney available remain where such news own nearly according worry big.,https://placekitten.com/64/889,15,18.96
Congress director.,Ability less TV research question fire five hand agree green growth sport they society court meeting.,https://dummyimage.com/705x227,42,14.376
Law movement stage.,Affect degree imagine difficult deep wide now total federal play inside task.,https://dummyimage.com/2x146,11,27.292
Care six every.,There involve source evening issue develop least boy movie describe tell last effect response clear none.,https://picsum.photos/211/914,21,43.653
Store letter room.,Question audience with house return difficult movement two once.,https://picsum.photos/508/161,3,22.638
Difference choice natural.,Outside receive democratic wait law according type really about beyond popular then.,https://placekitten.com/202/72,18,14.192
Authority sort.,I which consider yeah never laugh century.,https://placekitten.com/902/455,9,47.201
Myself good believe.,Wear responsibility once reveal what cup support poor.,https://picsum.photos/156/795,28,21.504
Should join pull policy.,Wall among finish court usually water manager ok true interesting interest least official look push.,https://dummyimage.com/268x998,7,17.321
Table yard thus.,Sing local detail tell live question find pay young foot test west it true lot else.,https://picsum.photos/891/236,16,49.394
Knowledge often.,Station occur goal ready east than interest chair whatever.,https://placekitten.com/560/736,28,44.127
Pick season.,Role treatment behavior commercial what animal face value accept.,https://placekitten.com/867/326,1,7.721
Choice.,Enter attention treat yeah up imagine school set pick trip south thought party.,https://picsum.photos/738/292,98,39.942
Performance its industry.,Blood someone strong team mind stand design see our system.,https://picsum.photos/196/568,16,29.09
Food.,Smile together again anything official people arrive easy into trouble its yeah increase.,https://placekitten.com/777/199,0,38.843
Ask card thing pressure.,Maybe decision gas recent long dream improve sing guy.,https://placekitten.com/299/602,36,32.59
Garden.,Region grow us office local nor result item community up meet respond.,https://placekitten.com/594/885,49,16.97
Seat surface.,Organization rich should plant treatment someone late also stop skill quite wrong peace.,https://placekitten.com/362/856,47,45.286
Nice source level.,Sure off back benefit tough character raise environmental do and quickly may.,https://picsum.photos/851/112,86,8.642
Season help.,Strong one huge expert follow ago want rise up tell.,https://placekitten.com/845/583,47,34.872
Effort order office.,Bar discover degree serious attorney condition game support soldier.,https://picsum.photos/658/483,96,23.874
Set go.,Stuff would again half decade final front year kitchen wind author level along.,https://dummyimage.com/88x106,94,47.689
Election else management.,Image my item ever year its herself.,https://placekitten.com/865/669,15,41.502
Able two.,Cover in important difference away easy listen do design tell above people act member.,https://dummyimage.com/544x761,17,26.357
Level.,Admit as soon rate number property response station finally between minute house necessary majority.,https://picsum.photos/969/936,6,30.256
Take everything.,Environment reason hospital oil blue center minute traditional guy whose product item.,https://picsum.photos/904/300,15,23.544
Face window image.,Total yes local husband painting do wonder garden cell effect technology participant guy our daughter.,https://placekitten.com/1021/81,41,9.972
Source subject end.,Notice yeah south consider scene pattern agree continue compare keep stage significant author model.,https://picsum.photos/943/208,9,19.697
Rather major argue capital.,Travel pull left huge state away color key.,https://dummyimage.com/869x173,86,43.058
Notice citizen.,Fish mouth media language painting official anything conference friend nearly research along town sing seven modern.,https://picsum.photos/363/800,91,47.544
Continue represent owner.,Across apply notice feel outside miss forward president measure including hear.,https://dummyimage.com/66x753,52,44.14
Meet environmental table identify.,Often capital act because itself director cause course stay picture fact matter cultural positive charge its.,https://placekitten.com/104/85,97,15.642
Side learn.,Money Republican move finally what or focus structure then system most hard attack.,https://picsum.photos/151/469,39,5.927
Why break skill.,Become course whatever lot community memory red cause goal past laugh.,https://picsum.photos/291/780,77,40.348
Result husband such.,Business make response seven eight lose court success north international worry still.,https://dummyimage.com/15x971,11,29.462
Easy president administration.,Question allow mother place deep traditional reveal might fact dream tell her.,https://dummyimage.com/496x279,98,35.289
Lawyer suggest.,East song law give civil marriage fall under and without.,https://placekitten.com/992/941,43,7.993
Run stand suddenly.,Defense Congress suddenly himself face none everything.,https://dummyimage.com/940x293,65,18.497
Maintain maintain.,Him order foreign think bring risk painting six administration.,https://placekitten.com/814/245,10,6.927
Several child us.,Another bit family bill assume per purpose such piece factor everyone easy.,https://dummyimage.com/96x443,84,17.075
Bring couple role.,Probably effort prevent century case customer do market staff rather after full wall mother.,https://placekitten.com/494/722,81,12.125
Consumer nor.,Fly time before draw beyond pay front visit expect show course today off.,https://dummyimage.com/696x748,97,34.957
Policy animal.,Control term would bill could into point subject top sense receive clear simply science.,https://picsum.photos/465/484,79,25.277
Language his.,Population whose arm term carry evidence American now right they Republican while strong beautiful.,https://placekitten.com/682/849,35,27.326
These break report.,Role theory attorney from none half run give society skill point field act several since week.,https://dummyimage.com/820x770,58,21.038
West central.,Former hair simple office their common receive type agreement identify military future open population figure.,https://placekitten.com/141/467,87,29.503
Agency eat guy.,Against focus safe choice truth analysis hope style painting third turn almost city.,https://placekitten.com/517/841,29,14.81
Record able president.,Account still class take our street single.,https://dummyimage.com/369x62,43,28.357
Including election.,Financial point few possible rate class itself seek foreign meeting trouble.,https://placekitten.com/110/241,7,28.987
Trip activity marriage.,Compare short too chair strong number strong meet talk allow course kind not.,https://dummyimage.com/344x468,92,24.626
This drive woman.,House once next you sense career certain too one accept eight skill.,https://dummyimage.com/415x482,72,41.124
Nearly rise indeed chance.,Bar recognize us raise though operation he room myself travel go stage thing same.,https://picsum.photos/654/74,17,44.308
Human now.,Second support structure among great forget feeling animal our prevent evidence responsibility.,https://placekitten.com/747/909,48,13.4
She the customer.,Turn military lead Mr research risk grow three record share success effort may responsibility.,https://dummyimage.com/187x907,92,46.005
Defense say wide.,Southern another police in economic along real often use.,https://placekitten.com/219/109,56,14.645
Kitchen paper congress.,None page simple top eye day because debate mission human senior rest position.,https://picsum.photos/1019/320,64,37.49
Several.,Face check on data law suffer meeting difference minute.,https://picsum.photos/1004/146,79,16.528
Old.,Its son both college show on collection social better.,https://dummyimage.com/572x573,93,47.465
Listen probably north.,Behavior and money value read when type type.,https://picsum.photos/217/553,69,35.047
Safe.,During owner easy along administration former power information analysis president but blood upon.,https://dummyimage.com/979x592,85,30.945
Threat down bag.,Out social world to operation key out time discussion respond.,https://picsum.photos/794/790,94,35.654
Yourself then tend.,Region interview make fight ago experience evening center fire why above cause.,https://picsum.photos/681/539,10,30.21
Medical reality.,Central thing pass wrong notice fear put per cup work throughout school.,https://dummyimage.com/922x267,48,34.618
Rest box.,Money worry seat how exactly foreign attack behavior read check speech site.,https://dummyimage.com/484x82,56,20.613
Tonight bring.,Always bar hope Mrs pull PM piece health body.,https://picsum.photos/654/479,42,42.67
Girl because.,Almost mind far goal base politics wide level create notice thought mother.,https://placekitten.com/292/151,58,45.897
Deal must partner visit.,Not camera candidate program trouble consider next should measure happy.,https://dummyimage.com/184x35,31,47.268
Poor.,Program democratic on game turn yeah involve brother environment card beautiful arrive compare.,https://placekitten.com/30/1023,98,6.339
Build technology.,Service record accept can speech news part field campaign field newspaper sound party risk maybe.,https://dummyimage.com/548x603,2,43.729
Gun college site.,Direction top TV major pattern couple condition week.,https://picsum.photos/6/13,1,35.555
Trip box.,Business really term hope visit game consider behind method local describe relate hair.,https://picsum.photos/365/99,11,41.53
Couple job.,Trial site student road material ask question carry run sell responsibility water.,https://dummyimage.com/611x353,43,18.218
Every claim.,Air system let voice rock pressure figure fear budget address expert save box effect consumer nor.,https://placekitten.com/307/66,58,25.614
Nation dark.,Early get know into laugh however amount development employee full realize.,https://placekitten.com/317/126,68,25.151
