itemName,itemDescription,pictureUrl,itemPrice,restaurantId
Professional.,Sister send current tend moment analysis apply bill class activity.,https://picsum.photos/977/752,8,15.095
Score read former.,Term current different step research four family go indeed rather social travel.,https://dummyimage.com/773x887,26,47.348
Answer star career.,Light single report name summer myself cold staff policy character.,https://placekitten.com/730/1017,63,20.909
Real hair.,If mission address science treatment animal figure particularly major.,https://placekitten.com/641/707,42,22.092
Require peace.,Person around pick again even five compare pressure worker hospital boy front girl customer product television.,https://picsum.photos/136/253,52,14.697
Stage professional commercial.,Poor box particular long agency floor read economy environment about sort parent whose available.,https://picsum.photos/995/447,30,37.261
Stop model.,Cell growth away high bank player couple network because amount reason until school of.,https://placekitten.com/564/7,71,36.958
The structure.,Smile who forget interview through important data deal page indicate dream growth fire somebody economy that.,https://placekitten.com/643/683,47,19.326
Total.,Return include food study debate hope generation voice cover than fall cell.,https://placekitten.com/735/53,77,23.83
It door employee.,Individual like control interview feeling control adult across president whole.,https://picsum.photos/725/208,97,20.083
Concern take pressure.,Within about different paper plant nearly author law reveal tough will product executive top particularly owner.,https://placekitten.com/114/322,97,22.052
Science imagine million study.,Meeting around prepare wish common data build various heart information according culture activity friend.,https://placekitten.com/822/671,16,36.704
Green.,Receive mean leader art house plan community eight media consumer conference.,https://dummyimage.com/549x936,98,20.149
Coach food dream.,Scientist determine audience late political wait voice develop study quite red.,https://picsum.photos/614/1017,1,15.946
By election method church.,Couple beyond forget describe own during under husband measure follow our last finally view check heart.,https://dummyimage.com/742x595,84,31.763
Write.,Sense significant source tough line break feeling truth eat level institution.,https://picsum.photos/66/263,85,16.589
Mr section perhaps agency.,Into matter seat wall success likely technology sound investment.,https://picsum.photos/222/475,19,23.539
More bed scientist.,Technology teacher board computer capital song clearly between agency debate production especially task.,https://dummyimage.com/538x783,83,46.479
Free.,Hope particular war far nature him away performance create occur very director.,https://placekitten.com/482/480,76,38.551
Rise top investment.,Onto best page cell attorney operation few question wind above past beyond fly her yet.,https://picsum.photos/149/807,0,36.805
His front against.,Each relate once management understand reach too staff leg skill.,https://placekitten.com/431/17,75,45.854
Last according.,Fear sit work expect current option many father player camera others change thought service however every.,https://placekitten.com/907/397,2,5.64
Cultural address energy.,Present see phone tough along style wide part suggest scientist continue.,https://dummyimage.com/643x969,1,39.17
Great congress class reach.,Republican six serve field fish north strategy many else mind either.,https://picsum.photos/135/354,10,6.194
Data arrive feeling.,Pay especially here reveal radio new assume young thus necessary nor support sister.,https://placekitten.com/434/896,59,35.715
Store recent.,Along allow foot couple around they usually development know garden what before air.,https://dummyimage.com/409x63,58,16.131
Style less public.,Enjoy whatever responsibility lead body discuss television travel small short physical people message usually marriage.,https://picsum.photos/208/62,74,24.146
Father dark.,Teach suggest democratic food decade general why a ask.,https://placekitten.com/699/426,45,25.272
Quickly actually coach.,Rich once add light hold attack address church color service fly theory eat specific recently.,https://placekitten.com/484/1018,61,8.997
Despite throughout seem.,Under short determine me program major raise position professional care parent central realize stock.,https://placekitten.com/12/444,49,27.946
Particular modern.,Test rise usually nor ask leg live method official arrive on discover heart.,https://picsum.photos/447/124,7,11.77
Community.,Let majority child attention above do open black food room health trouble too wife can.,https://dummyimage.com/564x470,37,31.793
Form to.,Partner rather card company begin simple record social throw hard training list until simple body guy.,https://dummyimage.com/367x713,59,9.566
One watch.,Require necessary movement type yet anyone surface.,https://picsum.photos/711/318,57,25.872
Skill home civil.,Summer respond this cut interest tree ask federal.,https://picsum.photos/231/720,70,44.919
Tax follow stay.,Well bag capital actually occur decide risk also away.,https://placekitten.com/525/452,87,43.718
Glass employee create.,Leader protect look hard court individual standard home increase store drug.,https://dummyimage.com/110x556,74,16.672
Car industry.,Recognize minute almost grow report nation face fill involve mind health.,https://picsum.photos/291/680,23,40.656
Call forward better.,Within decide you listen parent throughout visit let center piece parent.,https://picsum.photos/315/301,62,41.413
Also small exist across.,Whole during local medical other alone treat something figure.,https://placekitten.com/404/277,3,6.202
Ever education respond family.,Free bit exactly know senior create any role language successful.,https://dummyimage.com/563x21,37,15.14
Left medical.,North raise whom ball along into much system for describe crime west place.,https://placekitten.com/682/120,66,25.695
Course.,Information assume one loss trade central table military involve scientist than ask second southern.,https://picsum.photos/520/769,58,45.781
Former they nice structure.,Somebody event year even seem tend worry law position take modern.,https://picsum.photos/710/715,71,29.092
Car describe difference.,Heart indicate control arrive remember personal whom policy measure military event thousand consumer consumer ability.,https://dummyimage.com/6x397,57,31.899
Heavy hear.,Choice system about more similar behavior history space nature control.,https://picsum.photos/640/669,19,41.447
After against.,Dream town ask agree training when gas level play course.,https://picsum.photos/77/323,39,28.821
Watch prove represent not.,Something number agent individual little politics husband scene war material investment page newspaper we left.,https://placekitten.com/399/282,11,42.093
Specific their.,Event back right likely only media measure yeah sell seem image right wonder bad station future.,https://dummyimage.com/723x932,77,12.057
Moment technology.,Answer time score those response resource image buy them away green red have miss.,https://picsum.photos/892/138,80,11.822
Start reality.,Health during hot make home whose consumer base forget third wall.,https://dummyimage.com/594x756,37,48.589
Spring have will.,See system by series yeah eat history edge choose.,https://picsum.photos/85/705,10,11.789
He standard.,Same fight since campaign sing summer half knowledge member hard security father human thank from kitchen.,https://placekitten.com/781/870,66,6.257
Few past.,Member his open treat interesting whose onto picture sure write above be.,https://placekitten.com/1016/480,84,5.489
Sell keep.,History shoulder work behavior receive religious general painting marriage kitchen purpose kid democratic environmental interesting who.,https://placekitten.com/43/900,35,29.839
Policy firm.,Wind pretty morning kitchen across executive concern give room feeling fund drop without affect fund check.,https://placekitten.com/781/252,18,32.157
Thousand key firm around.,Cut high reason right run large middle us car discuss news order.,https://dummyimage.com/733x848,58,38.081
Message ever.,Store daughter war debate leg at son right crime during full team medical.,https://picsum.photos/724/574,15,23.692
Admit really four.,Improve nothing large style more subject community past gun office large tax ago.,https://dummyimage.com/898x305,66,33.041
People learn.,Run think audience face officer painting family majority appear perhaps.,https://picsum.photos/213/256,53,19.877
Majority several.,Authority daughter follow enjoy represent push establish enjoy increase.,https://dummyimage.com/185x274,47,31.482
Whose themselves citizen.,Provide matter population take safe shake knowledge or you message human action teach police.,https://placekitten.com/927/390,4,22.785
Story cut.,Government son source decade general hotel forget whose once point baby fly evidence memory beat.,https://picsum.photos/822/113,33,27.296
Call half quite.,Church by bar they purpose indeed fast check herself energy who stock.,https://placekitten.com/454/459,30,17.331
Color history shake.,Experience politics current argue rise wind too opportunity television well.,https://placekitten.com/35/603,92,28.636
People high.,Where soon style perform former raise class notice open rise image community food window fact.,https://dummyimage.com/353x105,90,28.494
Include debate including.,Learn other beautiful war economic financial force medical.,https://dummyimage.com/215x146,34,8.09
Become director.,Treatment already very far machine owner cup.,https://placekitten.com/137/787,94,43.907
Sound.,Upon discuss leader born leg quite commercial.,https://dummyimage.com/741x196,2,46.611
Some sort.,Operation now quickly discuss assume foot very industry approach partner choice.,https://picsum.photos/842/74,43,29.476
Resource hope.,Specific production affect they officer military Republican better issue scientist you positive issue enter time.,https://dummyimage.com/23x595,3,38.147
Water us house.,Physical everybody Mrs throw billion least watch movement receive.,https://picsum.photos/85/791,85,35.625
Often which perhaps.,Stop group view good spend keep cause note no Republican professor you.,https://dummyimage.com/913x187,79,43.752
Top real enough.,Test radio same argue name daughter environmental kind.,https://dummyimage.com/601x745,62,11.443
Still within young.,Its ability project prevent thus amount ground article effect themselves young edge business she.,https://placekitten.com/343/348,92,22.84
Under century arm.,Behind benefit enough official official step our mission identify test fall media hospital attention.,https://placekitten.com/877/205,74,18.649
Down peace.,Money final the next message away gun above someone movie third author somebody.,https://placekitten.com/45/312,89,35.824
Page bank.,Song partner truth exactly experience smile politics nothing push hair natural family.,https://picsum.photos/702/837,77,5.72
Remain single across.,Rise trip week rate free claim performance manager ball focus sort money chair food central.,https://picsum.photos/817/836,22,23.091
Similar door.,Spend heart head wait space trade south.,https://picsum.photos/993/50,1,48.826
You firm.,Bank attack manager effect quality determine debate southern matter manager.,https://dummyimage.com/502x757,88,22.048
Security truth throughout.,Government citizen better fight benefit affect security about difficult today look give.,https://placekitten.com/765/570,24,18.908
Common.,Minute college find stand brother sea last ground local together sound.,https://picsum.photos/259/835,64,17.539
Street big.,President decision name parent management cold food thing share you so.,https://picsum.photos/155/181,98,20.689
Discussion try.,Defense natural career performance stock enjoy never evidence short positive.,https://dummyimage.com/56x692,80,11.293
Democratic sister name.,Control week no together attack painting worker sit still.,https://picsum.photos/469/229,85,14.284
When build vote.,Help take pattern pretty large but reveal owner next both song six capital maintain.,https://placekitten.com/570/992,80,32.868
Strong view.,Like during occur finally remember thank remember TV radio sell project recognize.,https://picsum.photos/16/553,21,29.63
Himself moment ten race.,Tax energy its bill apply suffer during system.,https://picsum.photos/293/279,70,8.737
East this language.,Practice arrive tell important edge either seek per new new your station base wall study within.,https://dummyimage.com/357x119,14,46.137
Listen reason.,Learn billion produce clearly ago listen condition study wish figure.,https://placekitten.com/849/988,78,32.507
Customer myself pass what.,Quite argue word foreign cold former teach call run again campaign cup trade.,https://dummyimage.com/980x562,37,37.889
Develop that north.,Sign write control first tonight want just property exist.,https://picsum.photos/650/416,33,32.923
Difference thousand produce.,Challenge impact carry detail they item fight interest.,https://dummyimage.com/808x439,29,16.221
Quality room try.,Subject blood one painting box mother offer day represent tonight medical condition color why.,https://placekitten.com/510/361,20,24.685
Scene involve.,Particular positive guy series wish receive hospital several model.,https://dummyimage.com/964x523,80,24.631
Every save dinner.,After all cell him modern relate hundred name find car mission tell.,https://dummyimage.com/145x321,15,15.885
Place food.,Treat hour some billion voice speak memory.,https://picsum.photos/751/1010,27,15.462
Human home understand.,Democrat resource recognize enter manage network wide.,https://placekitten.com/735/824,38,39.847
Do listen material.,Author whose knowledge class should environmental case rate face option culture with air citizen.,https://dummyimage.com/206x149,35,20.144
Unit specific age.,Tonight science prove if without exactly turn thus region across condition five drop whom manage over.,https://picsum.photos/620/876,63,46.692
Three also develop.,Should stand prevent discussion we church teacher million only understand big former explain center.,https://picsum.photos/244/875,4,24.093
Use whose mention.,Girl issue concern hand project life court maintain per with moment vote want professor.,https://placekitten.com/564/922,81,33.508
Tell purpose project.,Outside page rest body cold certain political surface rich.,https://picsum.photos/971/309,22,29.991
Not build chair.,Condition technology good manage sort him community.,https://picsum.photos/992/444,87,27.751
Treatment old.,Year stuff page air challenge coach hotel sister sport by prove.,https://placekitten.com/947/840,44,15.478
Bring.,Fly meet she who hard PM cell everything nothing new.,https://picsum.photos/136/805,64,39.848
Any return.,Professional indicate guess community suggest enter low other son personal agreement before light soldier explain win.,https://picsum.photos/656/815,80,48.051
If stock.,Detail who he short serve save second event before eye seek prevent.,https://picsum.photos/732/994,47,10.831
Gun close list.,Television three edge many reach catch fine together.,https://dummyimage.com/51x364,82,31.068
Reduce trial world.,Grow pick general where analysis knowledge change where talk age.,https://placekitten.com/914/580,67,29.213
Fast deal civil.,Customer available current body meeting look plant development institution life hair provide.,https://placekitten.com/919/848,66,41.209
Generation.,Maintain consider music must summer take measure officer want them professor.,https://placekitten.com/616/230,88,46.912
Themselves policy now.,Fight cold whole edge data believe player.,https://dummyimage.com/552x705,33,11.58
Oil.,Research score player drop good very company as write blue discover usually let certainly because particularly.,https://placekitten.com/495/926,98,6.278
Man federal article.,Agency never air yourself because whose set.,https://placekitten.com/428/521,39,10.539
Herself your authority.,Trade add friend focus mouth join organization heart carry.,https://placekitten.com/786/541,63,40.746
Development.,Bar today truth stop could civil sea picture high.,https://dummyimage.com/1016x351,25,38.433
Off animal.,Time point table red stay college include physical research hotel challenge loss create again.,https://picsum.photos/766/690,14,24.591
Fill.,Fight always mouth send exactly mean how value dinner message throw image.,https://dummyimage.com/421x299,1,36.553
Hear forward.,Whether use air possible sport table animal head bill everybody stay blue morning.,https://placekitten.com/622/924,99,34.095
Work hundred.,Allow prevent office suddenly example anyone now him hold save food early still myself common.,https://placekitten.com/466/638,51,18.213
Answer others because.,Doctor himself better next part sport bill see while hard same sing increase would.,https://placekitten.com/901/178,70,23.133
Us cultural.,Life yes shake state that yet inside new seat work.,https://dummyimage.com/897x861,13,11.162
Place test ball.,Stay black mean threat religious house if center.,https://dummyimage.com/297x308,79,39.622
Hard everyone economy trade.,Girl music fall ability cell black condition than picture each degree hour various.,https://dummyimage.com/924x600,79,47.091
He maintain.,Through who television generation coach development summer loss.,https://picsum.photos/374/418,44,25.034
Determine region.,Program for measure message yourself all drug best concern Democrat though new rich fight past.,https://placekitten.com/273/180,21,18.99
Military here.,Beautiful bad production offer left phone explain myself face dinner million special well.,https://placekitten.com/94/586,38,28.662
Serious grow.,Into heavy people so career society crime history look stock something with.,https://placekitten.com/805/22,98,6.556
Close school worker.,Western base both receive production buy reach collection growth here wear since short beat sea theory.,https://dummyimage.com/24x256,43,9.902
Sea early race after.,Return far lay purpose significant reduce begin when marriage letter parent six until.,https://placekitten.com/992/356,95,5.104
Carry.,Business government term likely something write eight.,https://dummyimage.com/836x714,31,7.856
What.,Blood short final agreement green job door newspaper society analysis ready message why central.,https://dummyimage.com/177x486,21,40.185
Town still.,Four much firm area behavior organization realize third her work such.,https://dummyimage.com/536x470,68,26.774
Action simply forward.,Onto teacher cause where wear think serve school wind.,https://placekitten.com/913/12,14,11.006
Top again movie she.,Friend whose situation if get despite those by authority pay culture pass no class three.,https://picsum.photos/382/130,95,21.606
Young order.,Get event attack sort arm about strong relate buy offer inside.,https://dummyimage.com/644x55,52,46.351
Find culture less.,Plan this good visit range because image.,https://dummyimage.com/122x634,34,36.458
Enough hope much.,May trial attention rock western letter leg response later weight here chance improve building.,https://picsum.photos/227/421,8,36.027
Information age next.,Myself plant Mr how turn defense offer.,https://dummyimage.com/1006x655,66,28.211
Tax strong.,Sit nor everything economic office hit president economy drop mouth he leave despite top theory.,https://placekitten.com/935/77,68,46.076
Trial know rock.,Glass your himself could lead past manager ten factor bad nearly material operation take task.,https://dummyimage.com/196x489,87,34.125
Time gun assume.,Stock campaign person bill movie three like wrong.,https://placekitten.com/185/607,71,5.786
Certainly image than.,Article their team may move third high physical possible state.,https://placekitten.com/216/702,56,48.555
You simply.,Just system upon building down process author question per strategy.,https://dummyimage.com/410x21,71,33.569
Compare compare election whose.,Attack strong laugh fish suffer weight news recent opportunity street population world contain.,https://placekitten.com/839/205,84,45.76
Lose billion where draw.,Popular one audience they economy certain evening.,https://placekitten.com/858/95,7,47.475
Discover.,Support attack identify day second science check model.,https://placekitten.com/231/709,0,31.212
Stay include.,Bill anyone scene never computer hour anything agent.,https://placekitten.com/477/375,0,23.429
Wait you.,Somebody bar always building speech out whether never interview.,https://placekitten.com/861/874,44,16.796
Page.,Base ten thank fall kitchen return collection important realize behind from as on.,https://picsum.photos/1023/835,86,36.064
Become particularly firm.,Left recently effect social finally boy drug fly.,https://picsum.photos/1014/261,11,47.317
Himself offer land.,Most politics memory heart mean management main early hit lay response.,https://picsum.photos/615/179,59,40.133
Wonder world these while.,Future person become produce personal property shoulder focus above assume poor people.,https://placekitten.com/766/748,79,17.559
Current camera himself significant.,Type other institution from gun local military top water Mrs third late.,https://dummyimage.com/817x361,6,36.242
Live view her.,Stop room station and new step moment attorney language free usually need environmental.,https://picsum.photos/939/297,41,30.605
Run common magazine person.,End lead add add recognize bed practice little success nothing measure medical.,https://picsum.photos/52/295,69,25.357
Full store line.,Attention compare time their woman effort important.,https://dummyimage.com/184x1024,79,16.56
Food off maybe cover.,Determine sure peace scene officer far film different exist should simply.,https://picsum.photos/1006/982,39,44.464
Matter least.,Policy somebody accept herself four too yes major today property century really American.,https://picsum.photos/458/377,31,36.302
Treat.,Trouble affect president claim choose pass plan.,https://dummyimage.com/570x665,9,33.385
If those wind challenge.,Care federal model full owner clearly question.,https://dummyimage.com/582x303,64,44.086
Firm people fast.,Car week sell but wind draw town major effect pretty large important.,https://picsum.photos/598/467,75,29.544
Maintain order data.,Special half popular green according that issue crime him find now room purpose serve.,https://placekitten.com/869/957,2,39.07
Idea note mrs nature.,Poor score run financial number tax imagine government college.,https://dummyimage.com/318x297,42,16.1
Loss defense can coach.,Let spend detail might new American past director.,https://dummyimage.com/245x808,55,29.833
Away everything.,Suddenly again now international trouble grow address name enough pick drug week.,https://placekitten.com/14/889,32,15.298
Sport husband common.,Off analysis house reduce either eat inside source party relationship pull beyond.,https://placekitten.com/959/694,48,19.729
Throughout.,Hand success interview large gas sing consumer century.,https://dummyimage.com/767x701,74,28.679
Past city condition.,Argue trouble through either wait and food.,https://dummyimage.com/338x412,4,8.604
Boy may call.,Your six character song draw personal home threat goal participant old.,https://picsum.photos/504/99,65,20.643
Big your career.,Ok glass national positive still collection send suffer specific.,https://dummyimage.com/403x197,46,10.983
Baby why.,Woman sort often hotel enjoy away paper.,https://picsum.photos/663/362,8,30.961
Kid industry road.,Personal across sell hour choose record same quality middle.,https://placekitten.com/179/73,27,15.392
Between list.,Bag also stage never send physical pass staff.,https://dummyimage.com/405x807,87,27.287
Maybe mind.,Law low ball audience dog month would charge your today.,https://dummyimage.com/805x532,20,26.122
Whose should.,Field cell world before never eye center learn close need live indeed professor.,https://picsum.photos/516/443,97,39.274
Necessary finish hotel.,Then ago seem either around among note we score party American realize job too know behavior.,https://dummyimage.com/1000x779,9,10.099
New goal everybody.,Travel same water capital me she get I beyond animal team range.,https://placekitten.com/620/217,24,19.514
Difference mind section.,Help stage police toward among third show.,https://placekitten.com/371/162,60,41.406
Laugh.,Institution education price lawyer process available ground remember.,https://dummyimage.com/220x507,1,15.973
Heavy they product.,Rather rule most world each manage adult seek bad impact.,https://picsum.photos/210/418,89,43.115
Yard yourself until money.,Take fight partner serve end item blood early economic phone main still may.,https://picsum.photos/13/925,34,37.839
Crime hold.,Issue happy cost election production seek yet politics remain loss brother actually life decision threat leg.,https://picsum.photos/816/536,64,24.94
Just itself development.,Person pay day its eye material society future tend artist big structure control this because material.,https://picsum.photos/154/417,63,37.599
Almost college up.,Picture though always your human present computer enough eat mean box.,https://placekitten.com/670/507,90,12.701
American book.,Bill itself stuff popular appear executive claim.,https://dummyimage.com/987x266,92,14.108
Board soldier six.,Environmental social face field draw want population leave sister let possible very kind have.,https://placekitten.com/290/296,36,33.907
Mention any.,Glass happy art write partner bring property.,https://picsum.photos/643/187,45,13.839
Administration authority particular.,Simply provide avoid outside under record worker off know threat give my region blood bad.,https://dummyimage.com/850x109,86,41.397
Maybe then floor.,Already yet goal professor lead writer professor clear yet economic meeting.,https://placekitten.com/293/796,29,27.183
