itemName,itemDescription,pictureUrl,itemPrice,restaurantId
Color i.,But thought until tree who region give perhaps group week discuss person action risk response real.,https://dummyimage.com/568x983,71,7.928
Expect care then she.,Knowledge way hear word Mrs those sort human about piece such production must.,https://picsum.photos/715/972,65,19.55
Until upon seek entire.,Foreign both enter blue year imagine chance discussion allow food shake herself tough true president.,https://picsum.photos/581/305,94,7.944
Close tough police summer.,Month chance ago share enough throughout foot possible under surface design TV.,https://picsum.photos/853/595,37,44.6
Every choose finish light.,Reflect admit production authority candidate space case officer bad well age father low everyone.,https://placekitten.com/1021/958,26,24.368
Prevent consider.,Organization teacher both fund heart recent seven family seek play themselves minute worker.,https://placekitten.com/607/299,72,49.993
Can within.,Radio star out role control yeah again politics many manager talk herself.,https://dummyimage.com/852x509,88,44.667
Collection possible.,Per use detail southern live family key physical finish.,https://dummyimage.com/134x444,72,7.007
Product line study.,Politics measure seat town write discuss last build thank experience true thus peace.,https://picsum.photos/368/435,5,46.602
Prove meeting.,Section defense side mean oil tree couple last see marriage design protect.,https://placekitten.com/306/725,85,25.558
Fight allow.,And third line apply local pass fact should wear.,https://picsum.photos/278/342,78,15.264
Purpose full art.,Add factor administration world policy name range until professional.,https://dummyimage.com/818x609,85,41.713
Tv hot usually.,Leader least you current their dark cup.,https://picsum.photos/27/783,85,49.882
Reach life try.,But conference fly experience strategy very difficult pull western follow attack loss.,https://dummyimage.com/857x236,51,47.057
Research inside husband.,East once song agency truth any property tell accept rest may present partner practice clear.,https://placekitten.com/780/404,0,38.255
Begin interview keep.,Amount skill return agent month which involve forget organization pressure card realize final.,https://picsum.photos/7/150,99,44.877
Owner head chair.,Indeed movement without huge mean professor investment medical ready entire role score they card bank these.,https://placekitten.com/253/302,49,24.895
Six floor.,Administration between artist security religious bar crime so game possible begin black class modern.,https://picsum.photos/251/218,2,24.919
Leave system use.,Drive another real imagine onto leg seat similar explain structure TV up include direction.,https://picsum.photos/370/890,10,21.387
Senior end.,Son health seem safe cost quickly young price.,https://placekitten.com/189/1015,53,38.162
Well enter.,Kind stock affect break manager ground character dog wide majority week general.,https://dummyimage.com/623x493,89,5.897
Result sing protect.,Point significant security over especially white its back.,https://dummyimage.com/426x318,59,25.036
Fine.,Teach beautiful stand letter day civil it job risk public.,https://dummyimage.com/912x198,55,40.359
Standard level.,Charge protect customer movie others yeah of poor fish everybody wear assume would nearly main throw.,https://placekitten.com/43/774,87,34.203
Until case.,Pattern occur science into easy compare too hour production.,https://placekitten.com/909/640,66,37.575
Attack view keep.,Skin though lead scientist fund within leg what good myself most.,https://picsum.photos/395/540,89,27.041
Mouth seem.,Adult expect near information spend bank turn heavy time.,https://picsum.photos/948/85,24,6.007
Hard option hit.,Home them kitchen response but price dog wear culture.,https://dummyimage.com/815x366,78,29.873
Cut quite.,Lot worry low cover notice ever staff medical.,https://dummyimage.com/245x856,14,5.359
Likely.,Security green break ability to avoid soldier artist million vote.,https://placekitten.com/927/653,79,15.366
Run teacher.,Information there fight prove born reduce movement face rule man difference.,https://placekitten.com/883/707,28,24.576
Cell hear town.,Especially think candidate reach two major cup some early five him early far.,https://dummyimage.com/73x202,12,6.433
Surface tell size.,Technology teach peace mother teacher parent television least watch serve growth scientist.,https://placekitten.com/828/926,79,35.522
In.,Purpose when buy business local large return could improve fill just management.,https://picsum.photos/842/921,48,49.796
Economic worry.,Effort our hospital dinner anything start minute.,https://picsum.photos/55/112,21,27.35
Reflect spend democratic.,Travel hope past defense explain lay support.,https://dummyimage.com/694x658,62,26.225
Most cup.,Them establish top its score all world build forget listen.,https://placekitten.com/697/233,57,40.12
Film east.,Account executive stand this design recognize cause.,https://picsum.photos/1011/852,73,45.99
Play anyone.,Pretty answer family billion least nature trade identify machine member pretty human month receive everybody story.,https://placekitten.com/1005/17,93,16.764
Nice paper think.,Huge west the thing it your country kind goal.,https://placekitten.com/567/218,11,18.67
Describe need.,Study family benefit sit public card heavy behind sport service rest none lawyer show enjoy paper.,https://dummyimage.com/433x566,21,37.639
Bill yourself sound respond.,Need increase bag particularly there Republican look fine beyond situation assume anything notice receive far note.,https://placekitten.com/821/771,91,35.568
Blue hair only.,Culture enough any opportunity might magazine never word doctor that little suddenly.,https://picsum.photos/323/760,88,22.021
Common can.,Itself future experience federal computer mission market.,https://placekitten.com/713/10,64,27.68
Health rest effort.,Poor from training box positive arrive become field dog expert institution already everything interesting national detail.,https://dummyimage.com/143x591,1,39.439
Have born direction.,Bill place always pick south amount little art change everyone plant.,https://dummyimage.com/279x141,98,23.241
Leg image however.,Difficult time main billion design range what per grow consider.,https://placekitten.com/527/41,72,25.866
Green who front.,Activity reality serve produce various area watch friend scene Democrat chair necessary involve church meet.,https://picsum.photos/656/805,1,19.717
Measure theory crime.,These mind rule economic rather main us all kitchen white though dark their hear forget form.,https://placekitten.com/772/153,14,18.646
Share evidence.,South career tend sell allow activity include our himself.,https://placekitten.com/367/925,43,24.221
Few personal.,Important individual check how ok indicate us beat decision soon pass drop success.,https://dummyimage.com/458x460,46,37.573
Evening lot mean.,Choose pick foreign enjoy practice can event model expert magazine some probably quickly tough concern decision.,https://dummyimage.com/222x370,88,7.394
Three simple world.,Heavy law service yeah else physical treatment go hold number well example direction fall admit.,https://placekitten.com/406/840,18,6.221
Day country education.,Health do together consumer some spend soldier one break gas region.,https://dummyimage.com/792x212,20,13.641
Type heavy.,Get commercial past reason level enter consumer cost try parent health whatever.,https://placekitten.com/521/268,77,26.141
The.,Artist level test difficult trouble pick thought American national hold chair free many.,https://dummyimage.com/567x165,7,28.956
Human college.,Social wide that another listen various bed black she.,https://dummyimage.com/570x126,65,7.867
System lay.,Attack involve same better consumer hand season night unit case various type attention out activity take.,https://dummyimage.com/520x968,63,15.709
Community officer prepare.,Enter trouble wear speak reality people than career describe scientist but beat.,https://picsum.photos/1013/692,78,25.556
Also player citizen.,Yeah seem write term so finish executive.,https://picsum.photos/286/401,14,5.663
One trial.,Scientist consumer course pass hope blue deep point.,https://dummyimage.com/28x1005,69,23.239
Thousand pick.,Wrong day trial wrong situation move while.,https://dummyimage.com/665x631,45,14.489
Campaign rather citizen.,War focus skill step certain really participant.,https://placekitten.com/877/820,80,28.327
Necessary herself space idea.,Buy stay police region sure though bank house very each science floor early report produce more.,https://placekitten.com/126/24,24,40.183
Reason next several.,Whether series floor keep during leave should baby sea less development he rich pay.,https://dummyimage.com/280x903,84,11.282
Watch model item human.,Practice tonight since resource question figure so bad mouth.,https://dummyimage.com/492x876,66,15.83
Even important.,Size wait treatment way give enough pull community although almost American several admit method later.,https://picsum.photos/182/83,6,45.438
Human fear weight.,Among boy first get hold current player style full move black ready.,https://picsum.photos/14/248,9,11.887
Source television.,Stand conference citizen arm despite magazine likely sometimes effect where arrive guess.,https://placekitten.com/1000/477,84,13.015
Nation affect.,Become lawyer least talk sure open because talk early or doctor build natural think.,https://dummyimage.com/204x432,22,36.903
Full bill wait.,Example answer bed spring beautiful writer standard opportunity pretty structure drop week three shoulder.,https://picsum.photos/971/730,87,45.502
Entire cold.,Keep see every past form help section direction.,https://dummyimage.com/988x685,76,40.594
Month lot serious.,Million star character minute per wrong teacher form imagine again investment just stay various ground benefit.,https://picsum.photos/834/448,23,23.73
Million everything produce woman.,Decision hour experience once wind north author safe.,https://placekitten.com/326/569,84,9.444
And through.,Study attorney page former opportunity morning run why second environment.,https://picsum.photos/31/329,11,33.081
Image work imagine.,But law just remain civil morning choice such meet program vote.,https://placekitten.com/339/45,62,29.461
Nature just law customer.,Must represent issue sit toward answer answer.,https://placekitten.com/646/1015,35,48.792
Professional base.,Hot discover but school involve carry traditional upon water interesting close buy site remain.,https://placekitten.com/206/189,58,25.114
Give around choose.,Important edge compare try various question wrong vote religious southern position seat.,https://picsum.photos/598/588,35,11.493
Theory notice level.,Stuff magazine fear around seem door into foot dog southern.,https://placekitten.com/960/1007,58,6.437
Sister.,Ten senior evidence design pattern five institution newspaper parent organization question network appear us.,https://placekitten.com/965/719,36,35.285
Risk since.,Pick shake head development move until effect his least popular.,https://picsum.photos/287/560,35,18.481
Program what.,Truth tonight hit bed late still PM beautiful.,https://picsum.photos/495/200,88,45.859
Young over hotel.,Around popular process position some Mrs attorney military country try.,https://dummyimage.com/733x786,31,44.317
From bring green management.,End check only fill point per easy recent window once east lot cut where.,https://placekitten.com/298/623,21,12.467
Raise past attorney.,Audience approach mention mouth wear north capital ground own boy nothing sing.,https://placekitten.com/291/194,21,20.121
Up work.,Church population car soldier draw night high save church movie almost.,https://dummyimage.com/676x452,43,6.415
Ever health.,When find know including plant region this reach today western institution change should.,https://placekitten.com/441/545,95,7.188
Strong individual difficult.,Believe themselves site heavy worker born seat popular left continue base.,https://placekitten.com/9/174,93,33.947
Draw know.,Event begin watch over current door only mother operation although affect grow method important good.,https://picsum.photos/707/931,27,48.171
Establish difference wind.,Call boy win list position difficult throw standard coach more others capital address lay foreign.,https://placekitten.com/47/633,0,44.665
Region they example.,Medical tell sister fast if campaign table energy low whose lead class amount order poor.,https://dummyimage.com/853x365,77,13.453
Finish brother likely.,Why happy onto reduce why in fly which difficult indeed common job.,https://dummyimage.com/659x518,15,36.918
Production something fire.,Determine few citizen source foreign season open floor voice experience guess past everybody already technology.,https://picsum.photos/495/879,32,47.741
From security kind.,Think effect American professional bad seat few ground true quality cover bag become language possible until.,https://placekitten.com/282/358,88,47.418
Similar open.,Behavior you brother my act probably war minute lay ready usually record memory other.,https://picsum.photos/484/889,21,10.02
Pm tend.,Fight available raise rather necessary relate particularly standard room commercial offer.,https://dummyimage.com/706x930,50,23.164
From see.,Believe next fact school before reality ago our then amount.,https://placekitten.com/560/676,31,31.198
Themselves still moment.,Station clear scene wear road style like range final professor blood woman year wear finish.,https://picsum.photos/146/434,72,22.823
Important fire person.,Bar current receive beat way not attorney doctor help.,https://placekitten.com/360/636,94,19.612
Win floor.,Art matter couple agency or herself main box almost lawyer democratic.,https://dummyimage.com/130x383,48,48.115
Trouble garden staff win.,Protect ago discuss question feeling without card language again why military turn loss various.,https://dummyimage.com/15x121,33,40.0
Number floor.,Author head into occur as vote exist fire.,https://dummyimage.com/90x642,90,32.333
Claim media church.,Own rather less attention direction loss staff crime agreement most record by.,https://picsum.photos/263/830,5,27.123
East popular onto.,Structure cell water wife east service tree receive.,https://placekitten.com/72/109,70,6.45
Road sing pass.,For less product yard eat Congress develop world whatever future list radio model long source.,https://dummyimage.com/832x23,74,16.458
Attack anything good.,Record economy so information lay but college beautiful despite interest book piece everyone big.,https://placekitten.com/101/827,79,9.938
Approach dog season.,Involve them growth central ever help key room left matter find above.,https://picsum.photos/519/849,29,17.205
Sometimes include success.,Place go full goal something that land possible imagine conference lawyer institution necessary others its like.,https://placekitten.com/686/124,94,42.211
Lot.,Large ten wonder civil even degree single watch recognize strong.,https://picsum.photos/566/850,82,35.428
Beautiful them grow.,But red who plan student certain interest blue cultural.,https://picsum.photos/569/424,74,16.728
Him brother.,Win opportunity use baby put seem compare opportunity water skill eye statement into rule.,https://dummyimage.com/906x163,49,21.096
Popular similar without.,He represent hand book do there a near before.,https://placekitten.com/914/789,82,31.842
Cultural us.,Of outside fear significant offer price space parent upon important manager administration imagine most international.,https://picsum.photos/751/211,21,27.256
Operation size.,Tough growth those tree probably life success employee establish method.,https://placekitten.com/733/277,50,9.553
Catch bad poor.,Finally item threat assume can weight eye those if him nothing attention believe most ask.,https://placekitten.com/726/562,47,21.838
Including official finish.,Consumer against spend program career attorney summer arrive raise standard poor.,https://dummyimage.com/1007x256,65,8.968
Marriage fly tax.,Degree travel try paper foot executive least.,https://placekitten.com/787/943,76,35.324
Magazine choose safe.,Decade above matter resource nation some out which responsibility point use everyone act world ball.,https://placekitten.com/858/38,75,47.496
Score front structure.,Up administration there here woman nation little particular former choose experience letter at fund.,https://placekitten.com/700/907,39,45.206
Return any.,Glass old believe box our support strong anything green picture boy.,https://placekitten.com/802/814,3,33.627
Face paper involve.,Image impact opportunity enjoy effort join order employee become tell party in personal former offer player.,https://picsum.photos/99/416,90,48.975
Though role.,Building central worry drive look as sense discover everyone imagine even much several degree.,https://picsum.photos/241/360,11,34.873
Growth analysis fire.,Standard she hour movement enough season away may head.,https://picsum.photos/925/840,33,30.174
Base civil.,Company bank condition scientist cut life church local year best more million trade thus easy take.,https://picsum.photos/792/558,45,28.006
Sit audience much.,Realize large only response sing yeah whole.,https://picsum.photos/205/980,39,27.478
Leader hold mention campaign.,Seem process often capital upon if behind PM model management establish entire of.,https://dummyimage.com/280x775,7,24.85
Music notice two.,Value sense attorney American happen activity recognize sort agreement decision blood manage production treatment.,https://dummyimage.com/766x532,72,26.951
Quite.,Case hour meeting cold source treat culture even person run gas together.,https://picsum.photos/68/388,57,31.994
Thousand now.,Effort movement company laugh look let tell become service college explain along agree hand.,https://dummyimage.com/451x280,49,22.375
Toward information watch parent.,Value your wall small reveal four cultural money fire its.,https://placekitten.com/653/267,84,15.831
Usually enjoy threat.,Responsibility manager worry pattern usually old phone owner word political point election all reveal back.,https://dummyimage.com/225x947,76,13.879
Hot check professor.,Debate relate morning explain wrong executive tax manager serve nation range exist.,https://picsum.photos/470/54,44,11.108
Store upon.,Southern should blood PM item author recent sit present where challenge must pull any.,https://placekitten.com/89/1005,85,34.785
After middle.,Two usually age finally about stuff certainly until agency record skin marriage civil adult color.,https://dummyimage.com/519x916,11,25.044
Quality someone.,Full north certainly avoid seat amount think apply call part reason take approach improve company network.,https://placekitten.com/880/428,14,13.01
If more.,Appear maintain serve production large own bar fish back listen natural whole truth.,https://dummyimage.com/991x552,39,26.235
Point where.,Strategy style look recognize travel trouble those trade share exist parent shake place cost human.,https://placekitten.com/831/454,70,7.25
Likely become budget outside.,Vote tree check attorney seven source summer wonder between western least art.,https://picsum.photos/367/739,49,45.705
Suggest office into.,Among energy they like also suggest move brother role pull want practice wish break ask form.,https://picsum.photos/30/502,70,11.129
Reality visit number.,Eat risk amount test break through and often by source fund story.,https://dummyimage.com/64x234,55,45.678
Life kid.,Across employee short reason air station behind ago.,https://placekitten.com/746/328,30,37.956
Fill how investment.,Including feel truth three order war often decade.,https://picsum.photos/234/566,27,13.463
Reduce interview four.,Professor edge occur second compare add development standard.,https://dummyimage.com/859x529,1,33.037
Room parent.,Mother voice radio entire turn five gun hear or gas adult.,https://picsum.photos/135/808,86,37.654
Pressure window western.,Control same animal idea level analysis question.,https://picsum.photos/943/147,48,43.523
Brother decide.,Difference behind cover lot campaign music risk home necessary real.,https://picsum.photos/234/774,52,11.567
Too wind official worry.,Attack whatever believe discuss born throughout management measure her civil good middle mind eight.,https://picsum.photos/605/1006,90,20.488
Deal thousand board cultural.,Claim focus detail theory system ask bank position something rule old question wonder assume room to.,https://placekitten.com/425/725,39,47.929
Cup family very natural.,Popular provide board raise new special population.,https://placekitten.com/880/788,40,40.372
Scene able person.,Star challenge war strategy outside green main call increase force.,https://dummyimage.com/853x681,80,11.858
Cup machine level.,Be job ball religious him piece well program past under.,https://placekitten.com/446/771,11,26.534
Use there chair.,Subject control of source once teach loss share analysis see him under not oil line.,https://picsum.photos/888/272,38,28.657
Doctor young responsibility.,Feeling hand our movie daughter capital course trade.,https://placekitten.com/34/565,86,47.949
Behavior into still.,Throw voice hotel sister sometimes wait require which.,https://picsum.photos/63/903,67,6.615
Audience first through.,Wait kitchen entire hit sort feeling heart decision keep administration teacher war professor rise.,https://dummyimage.com/864x866,10,44.343
Focus about.,Remember past pick raise action season have size threat world market bill billion financial be.,https://placekitten.com/574/392,85,29.671
Home him their.,Friend speech quite daughter whole hour response do owner mission movement safe wear boy.,https://placekitten.com/323/512,51,14.847
Already black.,Billion generation national entire idea arrive might law share.,https://placekitten.com/23/833,96,45.714
Add long shake often.,Seven no imagine deep story join role certain forget sing central.,https://dummyimage.com/307x805,42,31.625
Pay collection range.,It road decide sound institution hand listen those read like floor television stuff show.,https://placekitten.com/528/881,79,8.294
Health less.,Water phone threat they able would reflect music forget case street lay determine include beat security.,https://dummyimage.com/858x47,82,21.436
True term art.,Occur present medical young law probably near particularly offer not.,https://placekitten.com/381/612,0,48.352
Prove wide politics.,Take back wrong weight smile exactly worker during then enough.,https://dummyimage.com/467x308,24,43.091
Create whatever organization.,Their seat discover thing miss weight computer religious add Mr.,https://placekitten.com/83/111,59,16.705
Upon and structure.,North guess democratic black how market ball mind.,https://picsum.photos/380/322,90,33.421
Data fish drug.,Require player affect film seek thing owner chance shoulder that visit.,https://placekitten.com/559/809,73,24.142
Visit necessary property.,Firm theory son back current three record national magazine cell.,https://dummyimage.com/431x841,1,17.797
Hard view.,Expert understand call agent look view form finally walk political box.,https://picsum.photos/182/331,70,28.586
Where.,Knowledge answer third paper get sister then.,https://placekitten.com/481/394,4,13.936
Less soldier music.,Four mother back owner sure note foot question region should executive.,https://picsum.photos/658/1014,80,5.815
Worker cost war.,World develop act effect east artist house word nation room half eight low street.,https://placekitten.com/500/263,62,28.677
Approach bed.,Difference summer stop agency really already treatment investment time.,https://picsum.photos/220/192,66,18.633
Fast short last performance.,Produce return year simple must pattern miss great law body friend lay.,https://dummyimage.com/492x375,58,24.199
Eye much task.,Continue statement trip over reason report push glass brother require involve low staff.,https://placekitten.com/245/845,21,6.8
Once cup life.,None somebody mention town huge heavy education light western at finally.,https://placekitten.com/384/916,12,13.902
Pattern cause.,Paper particular shake machine care tonight husband one modern tend hear bag report.,https://dummyimage.com/460x217,93,36.69
On.,Center build number ask news expert century become sea TV model particularly teach.,https://placekitten.com/594/434,23,7.05
Consumer peace bank.,Measure coach they maintain adult hand former simple.,https://picsum.photos/627/333,19,45.373
Main long sell.,Work ago senior tonight share up necessary partner good interview situation social become really risk risk.,https://dummyimage.com/163x565,45,43.152
Available senior place.,Us together treat back we may central peace.,https://placekitten.com/726/504,65,27.69
Simple reality.,Full tough accept PM fall father candidate only question ready religious place sing position.,https://placekitten.com/846/375,30,39.958
Suggest money page.,Mr benefit capital public address hit radio by full.,https://picsum.photos/429/744,40,21.768
Personal west.,Can item agency data step former question foreign institution loss change concern action result affect.,https://picsum.photos/570/583,16,23.601
Wonder party serve should.,It policy billion center generation no specific report company hotel low fall write success region.,https://dummyimage.com/406x455,0,8.345
Letter investment.,Record pattern everybody voice business finally stay teach past true development.,https://picsum.photos/753/767,78,39.3
Take business up.,Put work follow red heavy attention bank safe someone store clear seven human fact blood.,https://dummyimage.com/641x553,38,11.544
War wonder money.,Feel hotel international piece very production question team region.,https://dummyimage.com/352x345,34,21.691
Name last.,Kid to stuff need impact buy relate couple structure.,https://picsum.photos/311/724,93,42.661
